题号,输入Prompt,真实难度标签,系统预估难度,仲裁引擎,判定流程,真实调用链路,最终调用模型,最终总耗时,平均TPS,安全得分,执行后电量,执行后温度,最终模型回复
D01,请从算法复杂度角度，比较快速排序、归并排序与堆排序，并分析在不同输入分布下的性能差异，给出详细推导过程。,3,3,RF,MLP初判(3)->RF复判(3)->最终3,[初始路由]qwen-1.5b(score=45.00) -> [调用]qwen-1.5b -> [状态回写]qwen-1.5b|t=26.538s -> [质量通过],qwen-1.5b,26.538,14.5517,27.789,98.94,44.05,快速排序（Quick Sort）和归并排序（Merge Sort）是两种常见的排序算法，而堆排序是一种不稳定的排序算法。  1. 快速排序：  快速排序的时间复杂度为O(n log n)在最好情况下，最坏情况下为O(n^2)，平均情况略高于平均。它通常采用分治法策略，将数组分割成两部分，分别进行排序，再合并。时间复杂度主要取决于分治的过程。  2. 归并排序：  归并排序的时间复杂度是O(n log n)无论在最好、最坏或平均情况下。它使用了分而治之的策略，从输入数据分割中找出中间位置，重复地将较小数组进行合并。  3. 堆排序：  堆排序的时间复杂度为O(n log n)，且需要额外的空间来存储整个堆。堆是完全二叉树的一种特殊类型，可以通过调整其大小（删除一个节点或增加一个节点）来进行排序。  在不同输入分布下的性能差异主要体现在快速排序和归并排序上：   1. 快速排序：  - 当数组是随机的、均匀分布时，平均时间复杂度为O(n log n)，最坏情况为O(n^2)。  - 在小数据量或者大部分元素相等的情况下，快速排序会比其他两种算法更快。  2. 归并排序：  - 在所有情况下，归并排序的时间复杂度都是O(n log n)。 - 无论输入是均匀分布还是随机分布，其性能都比较稳定。  总的来说，对于大规模的数据集，归并排序和堆排序通常是更好的选择。而对于小规模数据或者需要频繁插入或删除元素的情况，快速排序可能更合适。
D02,请证明二分查找在有序数组中的时间复杂度为 O(log n)，并补充递归与迭代实现的边界条件分析。,3,3,RF,MLP初判(3)->RF复判(3)->最终3,[初始路由]qwen-1.5b(score=30.79) -> [调用]qwen-1.5b -> [状态回写]qwen-1.5b|t=32.478s -> [质量通过],qwen-1.5b,32.4781,14.3847,10.689,97.64,53.89,"### 问题背景  在计算机科学领域，最常用的搜索算法是**二分查找（Binary Search）**，它是高效地找到一个有序列表中指定元素位置的关键技术。它通过对数据进行连续分割来缩小搜索范围，每次分割都是目标值与中间位置元素的比较。  ### 时间复杂度分析  #### 递归实现时间复杂度为 O(log n)  - **递归基础条件**: 如果数组为空或没有更多的子数组可分，则二分查找终止。 - **递归条件**: 分成两半后，选择其中较小的一半继续查找。每次搜索范围减半。  因此，算法的时间复杂度是 $O(\log n)$，因为每次分割都使搜索范围缩小一半。  #### 迭代实现时间复杂度为 O(log n)  在迭代实现中，使用循环来模拟递归的过程。初始时将目标值与数组中的第一个元素比较，如果其比目标值大，则缩小数组的上半部分；如果相等则查找成功；否则将其移至较下一半继续比较。  ```python def binary_search_iterative(arr, target):     left = 0     right = len(arr) - 1          while left <= right:         mid = (left + right) // 2                  if arr[mid] == target:             return mid         elif arr[mid] < target:             left = mid + 1         else:             right = mid - 1                  return -1  # 如果元素不存在于列表中则返回-1 ```  ### 边界条件分析  - **数组为空**: 若输入的数组为None或长度为0，说明没有元素可搜索，此时直接返回 `-1` 或异常处理。    - **目标值不存在于数组中**: 在迭代实现中，如果循环结束时 `left > right` 但未找到目标值，则表示该值不在列表中；在递归实现中，当子数组无进一步分割可以进行时也直接终止。  总之，在有序数组中执行二分查找的时间复杂度严格为 $O(\log n)$。"
D03,请设计一个支持高并发读写的缓存系统，讨论一致性、淘汰策略、异常处理、限流熔断与可观测性架构。,3,3,RF,MLP初判(3)->RF复判(3)->最终3,"[受限降级]score=15.25,跳过:qwen-1.5b -> [初始路由]llama-1b(score=15.25) -> [调用]llama-1b -> [状态回写]llama-1b|t=68.831s -> llama-1b [质量拦截:复读机输出] -> [受限/妥协]score=-4.81,无法升级到:qwen-1.5b -> [云端兜底卸载] -> Cloud-API [成功]",qwen-1.5b,70.031,16.4577,-4.809,96.26,62.74,这是由云端大模型 API 生成的高质量兜底回答。
D04,请写出 Python 版本的图最短路算法，并比较 Dijkstra 与 Bellman-Ford 在负权边场景的区别与复杂度。,3,3,RF,MLP初判(3)->RF复判(3)->最终3,"[受限降级]score=1.15,跳过:qwen-1.5b -> [初始路由]llama-1b(score=1.15) -> [调用]llama-1b -> [状态回写]llama-1b|t=70.205s -> llama-1b [质量拦截:复读机输出] -> [受限/妥协]score=-18.13,无法升级到:qwen-1.5b -> [云端兜底卸载] -> Cloud-API [成功]",qwen-1.5b,71.4046,16.4913,-18.129,94.86,70.27,这是由云端大模型 API 生成的高质量兜底回答。
D05,请从微服务架构角度，详细说明服务发现、配置中心、链路追踪、分布式事务与幂等控制的工程权衡。,3,3,RF,MLP初判(3)->RF复判(3)->最终3,"[受限降级]score=-10.99,强制:qwen-0.5b -> [初始路由]qwen-0.5b(score=-10.99) -> [调用]qwen-0.5b -> [状态回写]qwen-0.5b|t=38.274s -> qwen-0.5b [质量拦截:复读机输出] -> [受限/妥协]score=-11.25,无法升级到:llama-1b -> [云端兜底卸载] -> Cloud-API [成功]",llama-1b,39.4738,27.3888,-11.247,94.48,65.98,这是由云端大模型 API 生成的高质量兜底回答。
D06,请回复收到,1,1,MLP,Rule命中->MLP复核(1)->最终1,[初始路由]qwen-0.5b(score=-4.78) -> [调用]qwen-0.5b -> [状态回写]qwen-0.5b|t=0.710s -> [质量通过],qwen-0.5b,0.7105,33.339,0.942,94.47,58.62,你好，很高兴看到你收到了我的回应。有什么我可以帮助你的吗？
D07,你好,1,1,MLP,Rule命中->MLP复核(1)->最终1,[初始路由]qwen-0.5b(score=6.25) -> [调用]qwen-0.5b -> [状态回写]qwen-0.5b|t=0.439s -> [质量通过],qwen-0.5b,0.439,35.7,10.977,94.47,52.57,你好！有什么可以帮助你的吗？
D08,1+1等于几,1,1,MLP,Rule命中->MLP复核(1)->最终1,[初始路由]qwen-0.5b(score=15.33) -> [调用]qwen-0.5b -> [状态回写]qwen-0.5b|t=0.419s -> [质量通过],qwen-0.5b,0.4195,39.4878,19.197,94.47,47.61,1+1等于2。
D09,2+3等于几,1,1,MLP,Rule命中->MLP复核(1)->最终1,[初始路由]qwen-0.5b(score=22.77) -> [调用]qwen-0.5b -> [状态回写]qwen-0.5b|t=0.431s -> [质量通过],qwen-0.5b,0.4307,36.7218,25.917,94.47,43.56,2+3等于5。
D10,3+5等于几,1,1,MLP,Rule命中->MLP复核(1)->最终1,[初始路由]qwen-0.5b(score=28.84) -> [调用]qwen-0.5b -> [状态回写]qwen-0.5b|t=0.393s -> [质量通过],qwen-0.5b,0.393,42.748,31.422,94.47,40.24,3+5=8
D11,今天星期几,1,1,MLP,Rule命中->MLP复核(1)->最终1,[初始路由]qwen-0.5b(score=33.82) -> [调用]qwen-0.5b -> [状态回写]qwen-0.5b|t=0.807s -> [质量通过],qwen-0.5b,0.8074,29.673,35.856,94.46,37.56,对不起，我无法确定今天的日期。我只能提供当前的日期信息。
D12,现在几点,1,1,MLP,Rule命中->MLP复核(1)->最终1,[初始路由]qwen-0.5b(score=37.84) -> [调用]qwen-0.5b -> [状态回写]qwen-0.5b|t=1.074s -> [质量通过],qwen-0.5b,1.0737,29.2964,39.435,94.45,35.4,对不起，我无法提供实时信息。我建议您查看当地的时钟或天气应用程序以获取当前时间。
D13,请说早上好,1,1,MLP,Rule命中->MLP复核(1)->最终1,[初始路由]qwen-0.5b(score=41.07) -> [调用]qwen-0.5b -> [状态回写]qwen-0.5b|t=0.562s -> [质量通过],qwen-0.5b,0.5624,30.8692,42.459,94.44,33.57,早上好！有什么我可以帮您的吗？
D14,请说晚上好,1,1,MLP,Rule命中->MLP复核(1)->最终1,[初始路由]qwen-0.5b(score=43.81) -> [调用]qwen-0.5b -> [状态回写]qwen-0.5b|t=0.327s -> [质量通过],qwen-0.5b,0.3274,36.1688,44.979,94.44,32.05,晚上好！
D15,请输出数字7,1,1,MLP,Rule命中->MLP复核(1)->最终1,[初始路由]qwen-0.5b(score=46.09) -> [调用]qwen-0.5b -> [状态回写]qwen-0.5b|t=0.258s -> [质量通过],qwen-0.5b,0.2578,50.8409,47.049,94.44,30.8,7
D16,请输出数字9,1,1,MLP,Rule命中->MLP复核(1)->最终1,[初始路由]qwen-0.5b(score=47.96) -> [调用]qwen-0.5b -> [状态回写]qwen-0.5b|t=0.236s -> [质量通过],qwen-0.5b,0.2356,71.0077,48.759,94.44,29.77,9
D17,北京是中国首都吗,1,1,MLP,Rule命中->MLP复核(1)->最终1,[初始路由]qwen-0.5b(score=49.51) -> [调用]qwen-0.5b -> [状态回写]qwen-0.5b|t=0.571s -> [质量通过],qwen-0.5b,0.5707,36.5206,50.088,94.43,28.96,是的，北京是中国的政治、文化和经济中心。
D18,上海在中国吗,1,1,MLP,Rule命中->MLP复核(1)->最终1,[初始路由]qwen-0.5b(score=50.72) -> [调用]qwen-0.5b -> [状态回写]qwen-0.5b|t=0.640s -> [质量通过],qwen-0.5b,0.6399,34.3641,51.162,94.42,28.31,上海是中国的省会，位于中国东部沿海地区。
D19,苹果是一种水果吗,1,1,MLP,Rule命中->MLP复核(1)->最终1,[初始路由]qwen-0.5b(score=51.69) -> [调用]qwen-0.5b -> [状态回写]qwen-0.5b|t=0.449s -> [质量通过],qwen-0.5b,0.4491,38.1601,52.077,94.42,27.76,是的，苹果是一种水果。
D20,水会结冰吗,1,1,MLP,Rule命中->MLP复核(1)->最终1,[初始路由]qwen-0.5b(score=52.51) -> [调用]qwen-0.5b -> [状态回写]qwen-0.5b|t=2.401s -> [质量通过],qwen-0.5b,2.401,30.0703,52.485,94.4,27.51,不会。水是液体，它没有固定的熔点和沸点，而是随温度的升高而逐渐变成气态（即沸腾）。  在常温条件下，水通常以液态存在；而在高温或低温条件下，水会转变为固态，并且它的融化需要热量才能完成。
D21,请写出 Python 版本的图最短路算法，并比较 Dijkstra 与 Bellman-Ford 在负权边场景的区别与复杂度。,3,3,RF,MLP初判(3)->RF复判(3)->最终3,[初始路由]qwen-1.5b(score=52.88) -> [调用]qwen-1.5b -> [状态回写]qwen-1.5b|t=55.342s -> [质量通过],qwen-1.5b,55.3421,14.0196,14.349,92.19,49.71,"以下是Python版本的Dijkstra和Bellman-Ford算法，以及它们在负权边场景下的区别：  ### Dijkstra 算法  Dijkstra算法是一种贪心算法，适用于无负权重路径的图。  ```python import heapq  def dijkstra(graph, source):     n = len(graph)          distances = [float('inf')] * n  # 初始化距离数组为无穷大     distances[source] = 0          pq = [(0, source)]  # 建立堆，每个元素是一个元组 (cost, node)      while pq:         cost, u = heapq.heappop(pq)                  if distance[u] < cost:  # 不需要更新             continue          for v in graph[u]:             alt = cost + graph[u][v]                          if alt > distances[v]:  # 需要更新                 distances[v] = alt                 heapq.heappush(pq, (alt, v))      return distances ```  ### Bellman-Ford 算法  Bellman-Ford算法是一种基于贪心的启发式算法，适用于所有类型的图。  ```python def bellman_ford(graph, source):     n = len(graph)          distance = [float('inf')] * n  # 初始化距离数组为无穷大          for _ in range(n-1):  # 遍历n-1次         for u in graph:             for v in graph[u]:                 if distance[u] + (graph[u][v]) < distance[v]:                      distance[v] = distance[u] + (graph[u][v])          return distance  # 带负权的图示例 graph = {     'A': {'B': -1, 'C': 4},     'B': {'A': -1, 'C': 8, 'D': 2},     'C': {'A': 4, 'B': 8, 'D': -5},     'D': {'B': 2, 'C': -5} }  source = 'A' print(bellman_ford(graph, source))  # 输出：[0, -3, -6, -7] ```  ### 边界条件比较  - **无负权边**:   - Dijkstra算法适用于所有无负权重的图。   - Bellman-Ford算法也适用于所有类型的图，包括有负权边的情况。  - **带负权的边**   - 在没有负权边的情况下，Dijkstra算法和Bellman-Ford算法都可以正常工作。   - 当图中有负权边时：     - Dijkstra算法会一直找到一个最短路径，直到所有点都被访问过，并返回最后一个到达点的距离。如果存在负权环，则可能会无限期地更新距离值，导致输出错误。     - Bellman-Ford算法仍然可以计算出正确的最短路径，但它会报告一个特殊的“环”，即图中有一条从起始节点到结束节点的负权回路。  ### 性能比较  - **时间复杂度**:   - Dijkstra算法的时间复杂度为O(V + ElogV)，其中V是顶点数，E是边数。   - Bellman-Ford算法的时间复杂度为O(E * V)。  总体来说，Dijkstra算法在无负权边的情况下更为高效。然而，在有负权边且可能有负权环的情况下，Bellman-Ford算法通常是一个更好的选择。"
D22,请从微服务架构角度，详细说明服务发现、配置中心、链路追踪、分布式事务与幂等控制的工程权衡。,3,3,RF,MLP初判(3)->RF复判(3)->最终3,"[受限降级]score=18.25,跳过:qwen-1.5b -> [初始路由]llama-1b(score=18.25) -> [调用]llama-1b -> [状态回写]llama-1b|t=34.206s -> llama-1b [质量拦截:复读机输出] -> [受限/妥协]score=9.76,无法升级到:qwen-1.5b -> [云端兜底卸载] -> Cloud-API [成功]",qwen-1.5b,35.4058,17.579,9.756,91.51,52.24,这是由云端大模型 API 生成的高质量兜底回答。
D23,请阅读以下逻辑并指出潜在 bug：if (x>0) {return f(x);} else {while(true){}}，并给出可证明终止的重构方案。,3,3,RF,MLP初判(3)->RF复判(3)->最终3,"[受限降级]score=14.05,跳过:qwen-1.5b -> [初始路由]llama-1b(score=14.05) -> [调用]llama-1b -> [状态回写]llama-1b|t=11.637s -> [质量通过]",llama-1b,11.6368,17.9524,13.848,91.28,49.68,"1.  **潜在bug**:      *   在条件表达式中使用不正确的逻辑。 `else { ... }` 是一个不正确的选择，因为它会覆盖当前的表达式。 2.  **可证明终止的重构方案**:     *   重写为： `if (x > 0) return f(x);`        -   将条件 `if (x > 0)` 写为 `else`,并且将此部分作为表达式内的语句。       -   如果该表达式返回值为 `true`,则执行 `f(x);`     *   **注意**: 在 Python 中，`return f(x)` 是一个更简单且更接近其原始意义的方法，尽管它会将 `x` 代入函数 `f()` 的参数 `x`."
D24,请比较 Transformer、RNN、LSTM 的长序列建模能力，结合注意力机制原理解释并行优势和内存代价。,3,3,RF,MLP初判(3)->RF复判(3)->最终3,"[受限降级]score=17.75,跳过:qwen-1.5b -> [初始路由]llama-1b(score=17.75) -> [调用]llama-1b -> [状态回写]llama-1b|t=38.181s -> [质量通过]",llama-1b,38.1811,17.2969,7.857,90.52,53.02,Transformer、RNN 和 LSTM 都是序列模型，但是它们在处理大小极大的数据集和特定任务方面有所不同。  **Transformer**  *   长序列建模的能力：Transformer 可以有效地处理大量的数据，尤其是在语音和语音识别等领域。 *   注意力机制原理解释： Transformer 的注意机制是一种自注意机制，能够让模型专注于特定的区域，很容易导致对长序列的理解过度。这种方法可能带来高内存耗。 *   行优势：Transformer 可以有效处理大小极大的数据集，有助于提高识别准确率和效率。 *   内存代价：Transformer 的注意机制需要大量内存空间，特别是在大型数据集的处理中。  **RNN**  *   长序列建模的能力： RNN 最适合处理特定长度序列（长度小于或等于 200）和长度较大的序列。 *   注意力机制原理解释： RNN 使用递归计算机制来处理数据，这使得模型能够从局部变量到全局变化。这个过程在某些情况下可能会导致过度的注意力，例如当输入序列很长或包含很多不同长度的特征时。 *   行优势：RNN 优于Transformer 的注意机制，因为它更适合处理较短的数据集（长度小于或等于 200）。在较大的数据集中，它可能会导致过度的注意力。 *   内存代价： RNN 的计算机制相对简单，内存空间需求较低。  **LSTM**  *   长序列建模的能力： LSTMs 最适合处理较短的长序列（长度小于或等于 100）和特定类型的数据，如时间序列。 *   注意力机制原理解释： LSTM 使用递归计算机制，但每个细胞都有两种状态 - 一些状态用于存储过去的信息，另一些状态用于预测下一个元素。LSTM 在处理较长的序列中比 RNN 更容易，因为它可以更有效地处理较短的序列。 *   行优势： LSTMs 比Transformer 和RNN更适合处理较长的序列和大数据集，例如时间序列中的数据。它在识别模式中非常有用，可以帮助预测接下来事件。 *   内存代价：LSTM需要内存空间来存储过去的信息和预测结果，这可能会对一些应用而言带来限制。  总的来说，如果您处理大型数据集，Transformer 和 LSTM 由于它们对于这种情况更适合，但 RNN 可以在较短序列或特定长度下工作。如果您的应用是非常小-scale，RNN 或者 LSTMs 的内存需求可能比较低。
D25,请从数学角度推导交叉熵损失与 softmax 梯度，给出每一步公式变形过程，并解释数值稳定性处理。,3,3,RF,MLP初判(3)->RF复判(3)->最终3,"[受限降级]score=12.28,跳过:qwen-1.5b -> [初始路由]llama-1b(score=12.28) -> [调用]llama-1b -> [状态回写]llama-1b|t=62.584s -> llama-1b [质量拦截:复读机输出] -> [受限/妥协]score=-5.70,无法升级到:qwen-1.5b -> [云端兜底卸载] -> Cloud-API [成功]",qwen-1.5b,63.7845,16.6659,-5.703,89.27,60.75,这是由云端大模型 API 生成的高质量兜底回答。
D26,1+1等于几,1,1,MLP,Rule命中->MLP复核(1)->最终1,[初始路由]qwen-0.5b(score=-0.06) -> [调用]qwen-0.5b -> [状态回写]qwen-0.5b|t=0.450s -> [质量通过],qwen-0.5b,0.4501,33.1725,4.962,89.27,54.32,1+1等于2。
D27,2+3等于几,1,1,MLP,Rule命中->MLP复核(1)->最终1,[初始路由]qwen-0.5b(score=9.58) -> [调用]qwen-0.5b -> [状态回写]qwen-0.5b|t=0.413s -> [质量通过],qwen-0.5b,0.4126,39.0846,13.692,89.27,49.05,2+3=5
D28,3+5等于几,1,1,MLP,Rule命中->MLP复核(1)->最终1,[初始路由]qwen-0.5b(score=17.49) -> [调用]qwen-0.5b -> [状态回写]qwen-0.5b|t=0.571s -> [质量通过],qwen-0.5b,0.5709,33.821,20.811,89.26,44.75,3 + 5 等于8。
D29,今天星期几,1,1,MLP,Rule命中->MLP复核(1)->最终1,[初始路由]qwen-0.5b(score=23.93) -> [调用]qwen-0.5b -> [状态回写]qwen-0.5b|t=1.666s -> [质量通过],qwen-0.5b,1.6658,30.665,26.454,89.24,41.34,对不起，我不能提供今天的日期。我的能力是回答问题和生成文本内容，而不包括特定的日期信息。如果你需要查询或获取今天的信息，请告诉我，我可以帮助你查找相关数据。
D30,现在几点,1,1,MLP,Rule命中->MLP复核(1)->最终1,[初始路由]qwen-0.5b(score=29.03) -> [调用]qwen-0.5b -> [状态回写]qwen-0.5b|t=1.251s -> [质量通过],qwen-0.5b,1.2507,32.1422,31.143,89.23,38.51,对不起，我无法提供实时时间信息。您可以通过查阅手机的时钟、访问天气网站或者使用其他时间查询工具来获取当前的时间。
D31,请说早上好,1,1,MLP,Rule命中->MLP复核(1)->最终1,[初始路由]qwen-0.5b(score=33.27) -> [调用]qwen-0.5b -> [状态回写]qwen-0.5b|t=0.329s -> [质量通过],qwen-0.5b,0.3286,40.6221,35.148,89.23,36.09,早上好！
D32,请说晚上好,1,1,MLP,Rule命中->MLP复核(1)->最终1,[初始路由]qwen-0.5b(score=36.90) -> [调用]qwen-0.5b -> [状态回写]qwen-0.5b|t=0.299s -> [质量通过],qwen-0.5b,0.2993,46.727,38.433,89.23,34.11,晚安！
D33,请输出数字7,1,1,MLP,Rule命中->MLP复核(1)->最终1,[初始路由]qwen-0.5b(score=39.87) -> [调用]qwen-0.5b -> [状态回写]qwen-0.5b|t=0.247s -> [质量通过],qwen-0.5b,0.2466,71.5165,41.133,89.23,32.48,7
D34,请输出数字9,1,1,MLP,Rule命中->MLP复核(1)->最终1,[初始路由]qwen-0.5b(score=42.32) -> [调用]qwen-0.5b -> [状态回写]qwen-0.5b|t=0.235s -> [质量通过],qwen-0.5b,0.2345,71.016,43.353,89.23,31.14,9
D35,北京是中国首都吗,1,1,MLP,Rule命中->MLP复核(1)->最终1,[初始路由]qwen-0.5b(score=44.33) -> [调用]qwen-0.5b -> [状态回写]qwen-0.5b|t=0.537s -> [质量通过],qwen-0.5b,0.5371,33.0822,45.102,89.22,30.09,是的，北京是中国的省会。
D36,上海在中国吗,1,1,MLP,Rule命中->MLP复核(1)->最终1,[初始路由]qwen-0.5b(score=45.90) -> [调用]qwen-0.5b -> [状态回写]qwen-0.5b|t=0.455s -> [质量通过],qwen-0.5b,0.4548,38.7063,46.542,89.22,29.22,是的，上海是中国的一个城市。
D37,苹果是一种水果吗,1,1,MLP,Rule命中->MLP复核(1)->最终1,[初始路由]qwen-0.5b(score=47.20) -> [调用]qwen-0.5b -> [状态回写]qwen-0.5b|t=0.508s -> [质量通过],qwen-0.5b,0.5079,33.2816,47.706,89.21,28.51,不是，苹果是植物果实的一种。
D38,水会结冰吗,1,1,MLP,Rule命中->MLP复核(1)->最终1,[初始路由]qwen-0.5b(score=48.26) -> [调用]qwen-0.5b -> [状态回写]qwen-0.5b|t=0.294s -> [质量通过],qwen-0.5b,0.2941,53.9292,48.711,89.21,27.9,不会。
D39,太阳从东边升起吗,1,1,MLP,Rule命中->MLP复核(1)->最终1,[初始路由]qwen-0.5b(score=49.18) -> [调用]qwen-0.5b -> [状态回写]qwen-0.5b|t=0.490s -> [质量通过],qwen-0.5b,0.4904,37.132,49.506,89.21,27.42,不是，太阳从西边升起。
D40,请回答：地球是圆的吗,1,1,MLP,Rule命中->MLP复核(1)->最终1,[初始路由]qwen-0.5b(score=49.90) -> [调用]qwen-0.5b -> [状态回写]qwen-0.5b|t=3.209s -> [质量通过],qwen-0.5b,3.2085,32.3708,49.683,89.18,27.31,不是。根据现代科学的理解，地球是一个近似圆形的球体。科学家们通过观测和测量，发现地球在赤道处略微扁平，而在两极稍微膨胀。这个形状使得地球成为一个椭球形天体，我们称之为“地球”。这是因为太阳光射到地球表面时，光线在地球的大气层中发生折射和散射，导致地面的光线弯曲，从而形成了地球的不规则形状。
